{
  "id": "doc_example_graphic",
  "type": "document",
  "schemaVersion": 1,
  "data": {},
  "children": [],
  "graphicPages": [
    {
      "id": "page_001",
      "name": "Diagram 1",
      "viewport": { "x": 0, "y": 0, "zoom": 1 },
      "frames": [
        {
          "id": "frm_001",
          "name": "Flow Overview",
          "data": {
            "x": 0, "y": 0, "width": 800, "height": 600,
            "background": "#f5f5f5", "clipContent": true,
            "showLabel": true, "labelFontSize": 12
          },
          "childElementIds": ["el_001", "el_002"]
        }
      ],
      "elements": [
        {
          "id": "el_001",
          "type": "rect",
          "frameId": "frm_001",
          "data": {
            "x": 100, "y": 100, "width": 160, "height": 60,
            "fill": "#ffffff", "stroke": "#171717", "strokeWidth": 1,
            "cornerRadius": 0, "label": "Start"
          }
        },
        {
          "id": "el_002",
          "type": "circle",
          "frameId": "frm_001",
          "data": {
            "x": 400, "y": 100, "width": 120, "height": 80,
            "fill": "#ffffff", "stroke": "#171717", "strokeWidth": 1,
            "label": "End"
          }
        }
      ]
    }
  ],
  "assets": {}
}
