{
  "id": "doc_example_mixed",
  "type": "document",
  "schemaVersion": 1,
  "data": {},
  "children": [
    {
      "id": "blk_001",
      "type": "heading",
      "data": { "level": 1, "align": "left" },
      "children": [
        { "id": "txt_001", "type": "text", "data": { "text": "Architecture Overview", "marks": [] } }
      ],
      "meta": { "createdAt": 1700000000, "version": 1 }
    },
    {
      "id": "blk_002",
      "type": "paragraph",
      "data": { "align": "left" },
      "children": [
        { "id": "txt_002", "type": "text", "data": { "text": "The following diagram shows the system flow:", "marks": [] } }
      ],
      "meta": { "createdAt": 1700000001, "version": 1 }
    },
    {
      "id": "blk_003",
      "type": "graphic",
      "data": { "graphicPageId": "page_001", "frameId": "frm_001", "height": 400 },
      "children": [],
      "meta": { "createdAt": 1700000002, "version": 1 }
    },
    {
      "id": "blk_004",
      "type": "paragraph",
      "data": { "align": "left" },
      "children": [
        { "id": "txt_003", "type": "text", "data": { "text": "As shown above, data flows from left to right.", "marks": [] } }
      ],
      "meta": { "createdAt": 1700000003, "version": 1 }
    }
  ],
  "graphicPages": [
    {
      "id": "page_001",
      "name": "System Flow",
      "viewport": { "x": 0, "y": 0, "zoom": 1 },
      "frames": [
        {
          "id": "frm_001",
          "name": "Flow Overview",
          "data": {
            "x": 0, "y": 0, "width": 800, "height": 600,
            "background": "#f5f5f5", "clipContent": true,
            "showLabel": true, "labelFontSize": 12
          },
          "childElementIds": ["el_001", "el_002", "el_003"]
        }
      ],
      "elements": [
        {
          "id": "el_001",
          "type": "rect",
          "frameId": "frm_001",
          "data": {
            "x": 50, "y": 250, "width": 160, "height": 60,
            "fill": "#ffffff", "stroke": "#171717", "strokeWidth": 1,
            "cornerRadius": 0, "label": "Input"
          }
        },
        {
          "id": "el_002",
          "type": "rect",
          "frameId": "frm_001",
          "data": {
            "x": 320, "y": 250, "width": 160, "height": 60,
            "fill": "#ffffff", "stroke": "#171717", "strokeWidth": 1,
            "cornerRadius": 0, "label": "Process"
          }
        },
        {
          "id": "el_003",
          "type": "rect",
          "frameId": "frm_001",
          "data": {
            "x": 590, "y": 250, "width": 160, "height": 60,
            "fill": "#ffffff", "stroke": "#171717", "strokeWidth": 1,
            "cornerRadius": 0, "label": "Output"
          }
        }
      ]
    }
  ],
  "assets": {}
}
